{
  "device_id": "DEV-000015",
  "inventory_snapshot_id": "INV-000001",
  "hostname": "prod-r420-015",
  "serial_number": "SN-R420-0015",
  "asset_tag": "ASSET-0015",
  "device_type": "server",
  "manufacturer": "Dell",
  "model": "PowerEdge R420",
  "model_normalized": "dell_poweredge_r420",
  "department": "Infrastructure",
  "location": "DC-Rack-05",
  "owner_team": "Platform SRE",
  "environment": "production",
  "lifecycle_status": "active",
  "last_seen_at": "2026-06-19T09:30:00Z",
  "components": [
    {
      "component_instance_id": "COMP-000101",
      "device_id": "DEV-000015",
      "component_type": "bios",
      "component_name": "System BIOS",
      "component_family": null,
      "vendor": "Dell",
      "version_raw": "02.00.21",
      "version_normalized": "2.0.21",
      "version_scheme": "semantic",
      "value_raw": null,
      "value_normalized": null,
      "status": "installed",
      "install_date": "2026-01-15",
      "last_updated_at": "2026-01-15T02:30:00Z",
      "metadata": {}
    },
    {
      "component_instance_id": "COMP-000102",
      "device_id": "DEV-000015",
      "component_type": "os",
      "component_name": "VMware ESXi",
      "component_family": null,
      "vendor": "VMware",
      "version_raw": "5.1.x",
      "version_normalized": "5.1.x",
      "version_scheme": "wildcard",
      "value_raw": "VMware ESXi 5.1.x",
      "value_normalized": "vmware_esxi_5_1_x",
      "status": "installed",
      "install_date": "2025-11-20",
      "last_updated_at": "2025-11-20T02:30:00Z",
      "metadata": {}
    },
    {
      "component_instance_id": "COMP-000103",
      "device_id": "DEV-000015",
      "component_type": "hba",
      "component_name": "QLogic QLE24xx",
      "component_family": "QLE24xx",
      "vendor": "QLogic",
      "version_raw": null,
      "version_normalized": null,
      "version_scheme": null,
      "value_raw": "QLogic QLE24xx",
      "value_normalized": "qlogic_qle24xx",
      "status": "installed",
      "install_date": "2025-11-20",
      "last_updated_at": "2025-11-20T02:30:00Z",
      "metadata": {}
    },
    {
      "component_instance_id": "COMP-000104",
      "device_id": "DEV-000015",
      "component_type": "cpu",
      "component_name": "Intel Xeon",
      "component_family": "E5-2400 V2",
      "vendor": "Intel",
      "version_raw": null,
      "version_normalized": null,
      "version_scheme": null,
      "value_raw": "Intel Xeon E5-2400 V2 family",
      "value_normalized": "intel_xeon_e5_2400_v2",
      "status": "installed",
      "install_date": null,
      "last_updated_at": null,
      "metadata": {}
    }
  ],
  "readiness": {
    "agent_health": "healthy",
    "pending_reboot": false,
    "disk_free_gb": 64,
    "battery_percent": null,
    "ac_power_connected": true,
    "bitlocker_suspended": true,
    "maintenance_window_available": true,
    "network_reachable": true,
    "last_seen_within_hours": 2,
    "metadata": {}
  },
  "metadata": {}
}